{
  "$schema": "../schemas/trusted-execution-proof.schema.json",
  "schema_version": "1.0.0",
  "protocol_id": "cejel-llm-calibration-v1",
  "provider": "github_actions_public_v1",
  "repository": "BargLabs/cejel",
  "commitment": {
    "git_commit": "0000000000000000000000000000000000000000",
    "document_sha256": "0000000000000000000000000000000000000000000000000000000000000000",
    "comment_id": 1,
    "comment_api_url": "https://api.github.com/repos/BargLabs/cejel/issues/comments/1",
    "created_at": "2026-07-22T00:00:00Z"
  },
  "runs": []
}
